{
    "$schema": "../assignment.schema.json",
    "title": "Integration Developer",
    "employer": "Billogram",
    "description": "Maintenance and development of file integrations towards customers that are not able to make use of the core product API. My responsabilities primarily consisted of solution design and architecture, implementation, testing and quality assurance of the integrations as any augmentations to the core product to fit customer needs.",
    "startDate": "2021-08",
    "endDate": "2023-08",
    "skills": [
        "Python",
        "git",
        "AWS",
        "DynamoDB",
        "SNS",
        "SQS",
        "S3",
        "HTTP",
        "REST",
        "Microservices",
        "Iterative_Development",
        "Agile",
        "DDD",
        "TDD",
        "linux"
    ]
}
