{
    "$schema": "../assignment.schema.json",
    "title": "Backend Developer",
    "employer": "THS Armada",
    "description": "Backend development for the annual career fair at KTH, as well as the associated app. Primary responsabilities consisted of designing and developing features requested by recruiters at the fair. The highlight was designing the backend and frontend interaction between existing backend servers and a brand new mobile app for that year.",
    "startDate": "2017-04",
    "endDate": "2017-10",
    "skills": [
        "Python",
        "Django",
        "git",
        "WireShark",
        "HTTP",
        "Postman"
    ]
}
